Idea,Category,Monetisation,Monetisation Reason,Ease of Build,Ease of Build Reason,Competition,Competition Reason
"Call Co-pilot for Sales","SaaS, Sales",5,"Sales teams have high budgets and pay for tools that increase revenue.",2,"AI-driven call assistance requires complex ML models and integrations.",3,"There are existing AI sales tools, but room for differentiation exists."
"Email Deliverability Testing","Email, Marketing, SaaS",4,"Email teams are willing to pay for inboxing improvements.",3,"Requires integrations with email providers and spam testing infrastructure.",4,"Well-known tools exist; differentiation on accuracy and UX."
"Website Feedback Widget","Productivity, SaaS",4,"SMBs pay for customer feedback tools; clear value proposition.",4,"A frontend snippet and backend storage; manageable MVP scope.",4,"Crowded space; differentiation via price, UX, and integrations."
"Conversational Data Analytics","AI, Analytics, Data, SaaS",5,"Enterprises pay for analytics time-savers.",2,"Natural language to SQL is hard; needs robust parsing/LLM.",3,"Some players exist but the space evolves fast."
"Reddit Marketing Tool","Marketing, SaaS",3,"Niche but strong need for marketers.",3,"API + dashboards; policy-compliant automation needed.",3,"Some tools exist; room for execution."
"Invoice Generator","Finance, SaaS",3,"Many free options; monetise via advanced features.",4,"CRUD + PDF; payments optional.",5,"Highly saturated."
"Expense Splitting App","Finance, Mobile",3,"Freemium potential; consumer subscriptions can be tough.",4,"Mobile/web app with sync; manageable MVP.",4,"Popular incumbents exist."
"Password Manager Alternative","Security, SaaS",4,"Security tools command solid pricing.",2,"Security and cryptography requirements are high.",5,"Crowded by strong incumbents."
"Project Management Platform","Productivity, SaaS",4,"B2B productivity tools monetise well.",3,"Large surface area but MVP possible.",5,"Very competitive landscape."
"Customer Support Platform","SaaS",4,"Clear ROI for businesses.",3,"Multi-channel + automation complexity.",5,"Strong incumbents."
"Gym Accountability App","Mobile",3,"Consumer subscription possible; churn risk.",4,"Mobile app with notifications/social.",4,"Many fitness apps exist."
"Landing Page Database","Marketing, SaaS",3,"Niche subscriptions; B2B appeal.",4,"Collect, tag, and search pages.",3,"Some alternatives exist."
"Failed Startup Database","Content",2,"Tough to monetise content-only databases.",4,"Data collection/curation heavy.",2,"Few strong incumbents."
"Tech Stack Hunter","Sales, Data, SaaS",4,"Sales/BD teams pay for lead intel.",3,"Scraping + enrichment + UI.",4,"Known competitors exist."
"Viral Content Analyzer","Marketing, Analytics, SaaS",3,"Marketers pay; depends on insights accuracy.",3,"APIs + scoring; ML optional.",3,"Several tools exist."
"SEO Keyword Research","SEO, Marketing, SaaS",4,"SEO budgets are large.",3,"Data sourcing + SERP parsing.",5,"Dominated by strong incumbents."
"Social Media Scheduler","Marketing, SaaS",3,"Commodity features; pricing pressure.",4,"APIs + queues + UI.",5,"Many incumbents."
"Competitor Analysis Tool","Analytics, SaaS",4,"B2B teams pay for intel.",3,"Scraping + enrichment + UI.",4,"Some strong players exist."
"Website Analytics Alternative","Analytics, SaaS",3,"Privacy-focused demand exists.",3,"Tracking SDK + dashboard.",4,"A few notable incumbents."
"Email Signature Generator","Marketing",2,"Hard to monetise; upsell via pro features.",5,"Simple generator + templates.",4,"Many free tools exist."
"Chrome Extension Builder","Chrome Extension, DevTools",3,"Niche; agencies/devs may pay.",3,"Meta tooling + scaffolding.",2,"Not many specialised builders."
"AI Cold Email Writer","AI, Email, Marketing, SaaS",4,"Outbound teams pay for ROI.",3,"LLM + prompts + deliverability checks.",4,"Crowded AI email space."
"Sales CRM Helper","Sales, SaaS",5,"CRMs tie to revenue; high willingness to pay.",3,"Integrations + workflow automation.",4,"CRM ecosystem is mature."
"Market Research Summariser","AI, Marketing, SaaS",3,"Useful but many substitutes.",4,"LLM summarisation + scraping.",3,"Varied tools exist."
"Idea Scoring Engine","SaaS",3,"Indie founders will pay modestly.",4,"Scoring model + UI.",2,"Few direct incumbents."
"Landing Page Heatmaps","Analytics, Marketing, SaaS",4,"Conversion optimisation budgets exist.",3,"Tracking, session replay, heatmaps.",4,"Known competitors."
"Invoice OCR Extractor","AI, Finance, SaaS",4,"Finance ops pay for automation.",3,"OCR + validation + exports.",3,"Moderate competition."
"Screenshot Diff Tool","DevTools, SaaS",3,"QA teams pay if accurate.",3,"Image diffing + CI integrations.",3,"Some incumbents exist."
"Contract Clause Checker","AI, Legal, SaaS",4,"Legal teams pay for time savings.",3,"LLM + clause rules + redlines.",3,"Legaltech is growing with AI."
"Privacy Policy Generator","Legal, SaaS",3,"SMBs pay small subs; compliance risk drives demand.",4,"Template-driven generator + updates.",4,"Many generators exist."
"Shopify Checkout Optimiser","E-commerce, Marketing, SaaS",4,"Merchants pay for conversion lifts.",3,"Shopify API + A/B testing.",4,"Apps ecosystem is competitive."
"Prompt Library for Teams","AI, SaaS",3,"Teams pay modestly for shared AI workflows.",4,"CRUD + versioning + permissions.",3,"Several tools exist."
"Code Snippet Manager","DevTools",3,"Dev productivity budgets exist.",4,"Local + sync + search.",3,"Some incumbents."
"LLM-Powered Support Bot","AI, SaaS",4,"Deflect tickets → clear ROI.",3,"LLM + retrieval + integrations.",4,"Crowded but effective execution wins."
"Recruiting Outreach Personaliser","Email, HR, Marketing, SaaS",3,"Agencies/HR teams pay modestly.",3,"Email, enrichment, and templates.",3,"Some players exist."
"Automated Interview Scheduler","HR, Productivity, SaaS",3,"SMBs will pay; competitive space.",4,"Calendars + reminders + links.",4,"Many incumbents."
"Pricing Page Optimiser","Analytics, Marketing, SaaS",4,"Direct impact on revenue.",3,"A/B tests + experiments.",3,"Several tools exist."
"Customer Churn Predictor","AI, Analytics, SaaS",4,"Retention lifts = high value.",3,"ML models + customer data integrations.",3,"A few players exist."
"Sales Email A/B Tester","Email, Marketing, Sales, SaaS",3,"Useful to outbound teams; limited willingness to pay.",4,"Email templating + stats.",3,"Some tools exist."
"Customer Feedback Classifier","AI, Analytics, SaaS",3,"Ops teams pay if insights are actionable.",4,"LLM + rules + dashboard.",3,"Moderate competition."
"Slack Knowledge Search","AI, Productivity, SaaS",3,"Knowledge workers value time savings.",3,"APIs + indexing + UI.",3,"Some tools exist."
"YouTube Transcript Summariser","AI, Content, SaaS",2,"Hard to monetise; great as a feature.",4,"LLM summarisation + fetch transcripts.",4,"Many alternatives exist."
"Data Cleaning Toolkit","Data, DevTools, SaaS",3,"Ops/analysts pay if it saves time.",3,"Transforms, validation, exports.",3,"Some competition."
"ETL for Founders","Data, SaaS",3,"Indie founders pay modestly.",3,"Connectors + pipelines + UI.",3,"Several players exist."
"Sales Call Recorder with Notes","AI, Sales, SaaS",4,"Saves rep time; increases close rate.",3,"Recording, diarisation, AI notes.",4,"Competitive (Gong, Chorus, etc.)."
"Product Analytics for Notion","Analytics, SaaS",3,"Notion ecosystem buyers exist.",3,"API + events + dashboards.",2,"Fewer incumbents in this niche."
"Churn-Focused NPS Tool","Analytics, SaaS",3,"Retention teams pay if predictive.",3,"Surveys + analysis + alerts.",3,"Some NPS tools exist."
"Product Roadmap Voting","Productivity, SaaS",2,"Hard to charge premium; works as feature.",4,"CRUD + votes + auth.",4,"Many tools exist."
"Onboarding Checklist Generator","Productivity, SaaS",3,"SMBs pay small subs for setup efficiency.",4,"Templates + steps + assignments.",3,"A few players exist."
"Customer Call Summaries","AI, Productivity, SaaS",4,"Time savings for CS teams; valuable.",3,"Transcription + LLM summarisation.",4,"Competitive with AI tooling."
"Meeting Notes Copilot","AI, Productivity, SaaS",3,"Useful but crowded assistants space.",3,"Transcription + actions + integrations.",4,"Crowded."
"Shared Snippets for Teams","DevTools, SaaS",3,"Developer teams pay modestly.",4,"Sync + search + permissions.",3,"Some tools exist."
"Terminal Recorder for Demos","DevTools",2,"Niche; OSS or freemium upsell.",3,"TTY capture + rendering.",2,"Few specialised tools."
"Open Source Licensing Scanner","DevTools, Legal",3,"Compliance risk drives demand.",3,"Scanning + rules + reports.",3,"Some incumbents exist."
"Docker Image Size Reducer","DevTools",2,"Niche dev tooling; monetise via teams.",3,"Optimisation and CI hooks.",2,"Few focused tools."
"Log Search with Alerts","Analytics, DevTools, SaaS",4,"Ops/SRE teams pay for reliability.",3,"Ingestion, index, alerting.",4,"Strong incumbents."
"GDPR Cookie Scanner","Legal, SaaS",3,"Compliance budgets exist.",4,"Crawler + reports.",4,"Many scanners exist."
"API Status Page Generator","API, DevTools, SaaS",3,"SMBs pay for uptime assurance.",4,"Heartbeats + UI.",3,"Competitors exist but room for UX-focused tools."
"Feature Flag Service","DevTools, SaaS",3,"Dev teams pay; price-sensitive.",3,"SDKs + targeting + analytics.",4,"Several incumbents."
"In-App Notification Centre","DevTools, SaaS",3,"Developer time-saver; priced per MAU.",4,"Embeddable UI + delivery.",3,"Some players exist."
"AI Data Enrichment","AI, Data, Sales, SaaS",4,"Sales/ops teams pay for contact/company data.",3,"Scraping + APIs + LLM fill-ins.",4,"Competitive with data vendors."
"AI-Powered Resume Builder","AI, HR, Productivity, SaaS",3,"Job seekers may pay, but price sensitivity is high.",4,"LLM + templates; moderate complexity.",4,"Many resume builders exist."
"Automated Cover Letter Writer","AI, HR, Productivity",2,"Harder to monetise directly; churn risk.",4,"LLM + job data integration.",4,"Many free AI tools exist."
"AI Interview Coach","AI, HR, Education",3,"Job seekers may pay modestly.",3,"LLM conversation simulation.",3,"Some similar products exist."
"Crypto Portfolio Tracker","Crypto, Finance, SaaS",3,"Retail investors pay for analytics.",3,"Exchange APIs + dashboards.",4,"Highly saturated market."
"NFT Price Alert Service","Crypto, Mobile, Finance",2,"Smaller audience post-hype.",4,"APIs + alerts + notifications.",3,"Some incumbents exist."
"Blockchain Explorer Alternative","Crypto, Analytics, SaaS",3,"Niche but some institutional demand.",2,"Requires deep infra and nodes.",3,"A few strong incumbents."
"DAO Governance Tools","Crypto, Governance, SaaS",3,"DAOs and Web3 orgs spend on governance.",3,"Smart contracts + dashboards.",2,"Still relatively open space."
"Smart Contract Security Scanner","Crypto, Security, DevTools",4,"High demand for security audits in crypto.",2,"Requires advanced static analysis + blockchain expertise.",3,"Some established players but growing space."
"DeFi Yield Aggregator","Crypto, Finance, SaaS",3,"Some users will pay a % fee on optimised yield.",2,"Complex smart contracts and integrations.",4,"Several players exist."
"Crypto Tax Calculator","Crypto, Finance, Legal, SaaS",4,"High demand for compliance tools.",3,"APIs + tax rules per region.",4,"Several players exist."
"Local SEO Rank Tracker","SEO, Marketing, SaaS",4,"SMBs pay for SEO visibility tools.",3,"Scraping SERPs + dashboards.",4,"Competitive SEO tooling space."
"Content Idea Generator","AI, Marketing, Content",2,"Hard to monetise; could be freemium upsell.",4,"LLM text generation.",3,"Several exist."
"Podcast Clip Generator","AI, Content, Audio",3,"Podcasters may pay for convenience.",3,"Audio processing + AI summarisation.",3,"A few incumbents exist."
"Video Subtitle Generator","AI, Content, Video",3,"SMBs and creators will pay.",4,"Speech-to-text + captions export.",4,"Well-served market."
"Short-Form Video Editor","Content, Video",3,"Creators will pay, but churn risk is high.",3,"Video editing + templates.",4,"Many incumbents exist."
"Content Repurposing Tool","AI, Content, Marketing",3,"Marketers pay for workflow streamlining.",3,"LLM + templates + integrations.",3,"Some players exist."
"AI Meme Generator","AI, Content, Entertainment",2,"Difficult to monetise beyond novelty.",4,"LLM + image generation.",3,"Some exist already."
"Voice Cloning SaaS","AI, Audio, SaaS",4,"Enterprises pay for synthetic voices.",2,"ML model training is expensive.",4,"Several strong players exist."
"Music Generation Platform","AI, Audio, Entertainment",3,"Creators may pay, but licensing issues arise.",2,"Training models for music is complex.",4,"Several players exist."
"AI Dungeon Master","AI, Entertainment, Gaming",3,"Niche but loyal audience.",3,"LLM interactive storytelling.",2,"Few direct competitors."
"AI Generated Comic Creator","AI, Entertainment, Content",2,"Mostly novelty, hard to monetise.",3,"Image gen + layout.",3,"Some projects exist."
"AI Script Writer","AI, Content, Entertainment",3,"Screenwriters may use as inspiration.",3,"LLM generation + templates.",3,"Several free tools exist."
"Stock Market Sentiment Analyzer","AI, Finance, Analytics",4,"Traders and funds pay for alpha.",2,"Complex NLP and data sourcing.",4,"Highly competitive."
"Retail Demand Forecasting","AI, Analytics, SaaS, Retail",4,"Enterprises pay high prices for accurate forecasting.",2,"Requires large datasets + ML models.",3,"Some incumbents exist."
"Energy Usage Optimisation","AI, Energy, SaaS",4,"Businesses pay for cost savings.",2,"IoT + ML forecasting complexity.",3,"Some niche competition."
"Predictive Maintenance for Machines","AI, IoT, SaaS, Industry",4,"Industrial clients pay for reduced downtime.",2,"Sensor integrations + ML models.",3,"Moderate incumbency."
"AI Tutoring Assistant","AI, Education, SaaS",3,"Parents/students pay, but churn is a risk.",3,"LLM dialogue + curriculum content.",3,"Some existing products."
"Language Learning with AI","AI, Education, Mobile",4,"Large consumer market with high demand.",3,"LLM + speech recognition + gamification.",5,"Very crowded with strong incumbents."
"Mathematics Problem Solver","Education, AI",3,"Students may pay but many free tools exist.",3,"Symbolic computation or LLM.",4,"Many incumbents (e.g. Wolfram Alpha)."
"Homework Grader","Education, AI, SaaS",3,"Schools pay modestly for grading automation.",3,"OCR + LLM + rubric system.",3,"Some competitors exist."
"Personalised Study Planner","Education, Productivity, Mobile",2,"Difficult to charge much; high churn.",4,"Calendar + reminders + adaptive logic.",4,"Many free alternatives exist."
"Collaborative Whiteboard Tool","Productivity, Collaboration, SaaS",3,"B2B adoption possible but space is crowded.",3,"Realtime sync + drawing UI.",4,"Several strong incumbents exist."
"Shared Knowledge Base","Productivity, SaaS",3,"SMBs pay for internal documentation tools.",4,"CRUD + search + permissions.",4,"Crowded space."
"Goal Tracking App","Productivity, Mobile",2,"Hard to monetise; consumer churn risk.",4,"Mobile/web app with goals + streaks.",4,"Crowded with habit apps."
"Habit Streak Tracker","Productivity, Mobile, Health",2,"Consumer apps are hard to monetise beyond subscriptions.",4,"Simple streak counter + reminders.",4,"Highly saturated space."
"Mindfulness App with AI Coach","Health, AI, Mobile",3,"Some consumers pay for guided meditation.",3,"LLM chat + audio content.",4,"Headspace/Calm are strong incumbents."
"Meal Planner with Recipes","Health, Food, Mobile",3,"Families/individuals pay modestly for personalised planning.",3,"Recipe DB + recommendation engine.",4,"Crowded space with free alternatives."
"Calorie Tracking App","Health, Food, Mobile",3,"Freemium possible; ads common.",4,"Database + barcode scanner.",5,"Very crowded market."
"Fitness Coaching Platform","Health, Fitness, SaaS, Mobile",4,"People pay for personal trainers and plans.",3,"Workout tracking + video content.",4,"Many incumbents."
"Sleep Tracking App","Health, Mobile, Wearables",2,"Most consumers expect free or hardware integration.",3,"Mobile sensors + analytics.",4,"Wearables dominate this niche."
"Water Intake Tracker","Health, Mobile, Productivity",2,"Low willingness to pay; ads more likely.",4,"Simple reminders and logging.",4,"Many free competitors."
"Pet Health Record App","Health, Pets, Mobile",3,"Pet owners may pay; vets might partner.",4,"CRUD + reminders + data sync.",3,"Moderate competition."
"Dog Walking Marketplace","Pets, Marketplace, Mobile",4,"Commission-based revenue is strong.",3,"Marketplace with scheduling + payments.",4,"Some incumbents like Rover exist."
"Pet Training App","Pets, Mobile, Education",2,"Pet owners may not pay much; ads possible.",3,"Video content + gamification.",3,"Some incumbents exist."
"Smart Home Automation Dashboard","IoT, Smart Home, SaaS",3,"Hardware tie-ins may boost revenue.",3,"IoT integration + dashboard.",4,"Big tech already dominates."
"Home Energy Monitoring App","IoT, Energy, Mobile",3,"Consumers pay for energy cost savings.",3,"IoT sensors + analytics.",3,"Some players exist."
"Air Quality Monitor Dashboard","IoT, Environment, Mobile",3,"Consumers and schools may pay.",3,"IoT sensors + data viz.",3,"Moderate competition."
"Neighborhood Safety App","Mobile, Safety, Community",2,"Difficult to monetise; trust issues.",3,"Crowdsourcing + maps.",3,"Some competitors exist."
"Hyperlocal News Aggregator","News, Community, Mobile",2,"Ads-driven, but low margins.",4,"Scraping + aggregation.",3,"Few strong incumbents."
"Digital Business Card App","Productivity, Mobile, Networking",3,"Professionals may pay for premium features.",4,"Simple sharing app.",3,"Some incumbents exist."
"Virtual Event Platform","Events, SaaS, Collaboration",4,"B2B events monetise strongly.",2,"Complex real-time video infra.",4,"Several incumbents."
"Hybrid Work Scheduler","Productivity, SaaS, HR",3,"Companies may pay, but adoption risk.",3,"Calendar + resource allocation.",3,"Some competitors exist."
"Employee Wellness Platform","Health, HR, SaaS",4,"Enterprises pay for wellness tools.",3,"Tracking + content + rewards.",3,"Moderate competition."
"Corporate Learning Platform","Education, HR, SaaS",4,"Enterprises pay for L&D solutions.",3,"Course hosting + tracking.",3,"Some competitors exist."
"Team Recognition App","HR, SaaS, Productivity",3,"SMBs may pay for culture tools.",4,"Gamified badges + feed.",3,"Moderate competition."
"Shift Scheduling Tool","HR, SaaS, Productivity",4,"SMBs in retail/hospitality pay for this.",3,"Calendar + rules engine.",3,"Moderate competition."
"Remote Work Productivity Tracker","HR, SaaS, Productivity",3,"SMBs may pay, but privacy concerns.",3,"Activity tracking + reporting.",4,"Competitive space with incumbents."
"Virtual Office Metaverse","Metaverse, Collaboration, SaaS",3,"Novelty-driven; uncertain monetisation.",2,"Complex 3D + networking.",2,"Few strong players yet."
"Knowledge Sharing Community","Community, Education, SaaS",2,"Hard to monetise communities without scale.",4,"Forum + Q&A system.",4,"Communities exist for most niches."
"B2B Marketplace for Services","Marketplace, B2B, SaaS",4,"Strong monetisation through commissions.",3,"Marketplace infra + payments.",3,"Moderate competition."
"Freelancer Portfolio Builder","Freelance, Productivity, SaaS",3,"Freelancers may pay for premium features.",4,"Portfolio sites are simple CRUD with design templates.",4,"Many incumbents like Behance and Dribbble."
"Remote Job Board","Jobs, Marketplace, SaaS",3,"Companies may pay to post jobs, but competition is strong.",4,"Job boards are relatively simple with filtering/search.",5,"Highly saturated market."
"Niche Job Board (e.g. Web3 Developers)","Jobs, Marketplace, SaaS",4,"High-value niche roles can generate strong revenue.",4,"Simpler than broad job boards, just filtering and niche focus.",3,"Less competition in narrow niches."
"Freelancer Marketplace","Freelance, Marketplace, SaaS",4,"Strong commissions and platform fees possible.",3,"Two-sided marketplace with payments.",5,"Very crowded market (Upwork, Fiverr)."
"Micro-Consulting Platform","Consulting, Marketplace, SaaS",4,"Experts can charge for advice; commissions possible.",3,"Booking + video call infra.",3,"Moderate competition, fragmented."
"Paid Newsletter Platform","Content, Creator Economy, SaaS",4,"Creators directly monetise through subscriptions.",3,"Payments + email infra.",4,"Strong incumbents like Substack."
"Podcast Monetisation Platform","Content, Creator Economy, Audio",4,"Growing market; hosts want revenue options.",3,"Audio hosting + ad matching.",3,"Moderate competition."
"Video Course Platform","Education, Content, SaaS",4,"Strong consumer and B2B demand for online learning.",3,"Video hosting + LMS features.",4,"Crowded with Udemy, Teachable etc."
"Micro-SaaS for Creators (Analytics, Tools)","Creator Economy, SaaS, Analytics",3,"Small but paying niche audience.",4,"Focused single-purpose tools.",3,"Competition is fragmented."
"Online Tutoring Marketplace","Education, Marketplace, SaaS",4,"Strong monetisation through commission on tutoring.",3,"Booking + video calls.",4,"Some strong incumbents like Preply."
"Parenting Tips Community","Community, Parenting, Content",2,"Hard to monetise communities without scale.",4,"Forum-style app.",3,"Some competitors exist."
"Local Babysitter Marketplace","Parenting, Marketplace, SaaS",4,"Parents pay; commissions possible.",3,"Booking + payments + reviews.",3,"Moderate competition."
"Online Therapy Platform","Health, Mental Health, SaaS",4,"Strong B2C monetisation through therapy sessions.",2,"Complex legal and compliance requirements.",4,"Strong incumbents like BetterHelp."
"Telemedicine Platform","Health, SaaS, Medical",4,"High willingness to pay in healthcare.",2,"Compliance-heavy and infra-intensive.",4,"Many players exist."
"AI Symptom Checker","Health, AI, Medical",3,"Consumer trust issues but potential in B2B partnerships.",2,"AI + regulatory complexity.",3,"Moderate competition."
"Remote Patient Monitoring Platform","Health, IoT, Medical",4,"Strong B2B monetisation with hospitals/clinics.",2,"IoT + compliance heavy.",3,"Some incumbents, but fragmented."
"Digital Pharmacy","Health, E-commerce, Medical",4,"High revenue potential, regulated.",2,"Complex logistics and compliance.",4,"Strong competition already."
"Chronic Condition Support App","Health, Community, Mobile",3,"Consumers may pay; insurers may partner.",3,"Tracking + community.",3,"Some competitors exist."
"Elder Care Coordination Platform","Health, Family, SaaS",4,"Families may pay; potential B2B with care providers.",3,"Scheduling + reminders.",3,"Moderate competition."
"Medication Reminder App","Health, Mobile, Medical",2,"Low willingness to pay; ads possible.",4,"Simple reminders + notifications.",3,"Moderate competition."
"Home Workout Video Platform","Health, Fitness, Content",3,"Consumers may pay subscriptions for content.",3,"Video hosting + streaming.",4,"Competition from YouTube/fitness apps."
"Nutrition Coaching App","Health, Food, Mobile",3,"Some consumers may pay for personalised plans.",3,"Meal planning + coaching chat.",3,"Some competitors exist."
"Mental Health Journal","Health, Mental Health, Mobile",2,"Hard to monetise consumer journaling apps.",4,"Simple CRUD journaling.",4,"Many free alternatives."
"Sleep Tracking App","Health, Mobile, Wellness",3,"Freemium + upsell to premium analytics.",3,"Mobile sensors + charts.",4,"Strong incumbents like Fitbit, Oura."
"Mindfulness Meditation App","Health, Mental Health, Mobile",3,"Subscriptions possible but crowded space.",3,"Audio streaming + notifications.",5,"Very strong incumbents like Calm, Headspace."
"Corporate Wellness Platform","Health, B2B, SaaS",4,"Enterprises will pay for employee wellness.",3,"Dashboards + integrations.",3,"Growing space, moderate competition."
"Virtual Fitness Classes","Health, Fitness, Content",4,"Consumers pay subscriptions for live classes.",3,"Video streaming infra.",4,"Strong competition (Peloton, etc.)."
"AI Personal Trainer","Health, AI, Fitness",4,"Strong consumer appeal for personalised fitness.",2,"Requires AI model + exercise recognition.",3,"Emerging space with startups but not fully saturated."
"Pet Health Tracking App","Pets, Health, Mobile",3,"Pet owners spend readily; potential subscriptions.",3,"Mobile tracking + reminders.",2,"Less crowded than human health apps."
"Pet Sitting Marketplace","Pets, Marketplace, SaaS",4,"Strong consumer demand; commission model.",3,"Marketplace infra + reviews.",3,"Moderate competition (Rover, etc.)."
"Pet Adoption Platform","Pets, Community, Marketplace",2,"Harder to monetise directly; possible donations or ads.",4,"Listings + search.",3,"Moderate competition, mostly non-profit run."
"Mind Map Creator","Productivity, SaaS",3,"Productivity tool; potential freemium for professionals and students.",4,"Frontend-heavy app; mind map generation manageable with existing libraries.",3,"Some mind mapping tools exist, but auto-conversion from notes is niche."
"Landing Page Generator for App Listings","Marketing, SaaS",4,"Targeted at app developers; potential subscription for ongoing page generation.",3,"Requires template generation and API integrations for SEO and design matching.",3,"Some landing page tools exist; niche focus on app stores helps differentiation."
"Chargeback Prevention Tool","Finance, SaaS",5,"Financial tool; businesses are willing to pay to reduce losses from disputes.",3,"Requires payment gateway integrations and transaction monitoring.",3,"Few tools provide guaranteed reduction to 0%, some competition exists."
"QR & Barcode Scanner with Generator","Mobile, Productivity",3,"Free basic version; potential premium for business analytics and batch scanning.",4,"Mobile app with standard scanning libraries; QR code generation is straightforward.",4,"Many QR apps exist; differentiation via multi-format support and business focus."
