"AI Content Detection Tool","AI, Productivity",3,"Free basic tool; could monetise via enterprise insights or API access.",3,"Needs AI summarisation and voting system; moderate complexity.",3,"Several AI detection tools exist; community voting adds differentiation."
"Cross-Platform Social Media Screenshot Tool","Productivity, SaaS",3,"Freemium; professionals and agencies may pay for advanced features.",3,"Screenshots and formatting across platforms is moderately complex.",3,"Few tools provide multi-platform, pixel-perfect screenshots."
"Reddit Pain Point to Product Platform","Analytics, SaaS",4,"SaaS for idea validation; could sell to product teams and founders.",3,"Requires scraping, data analysis, and a lightweight dashboard.",3,"Some platforms exist but few focus on Reddit specifically."
"Free Invoice Generator","Finance, SaaS",3,"Could monetise via premium features or pro templates; basic version is free.",4,"Frontend PDF generation; lightweight backend or client-side storage.",4,"Many invoice generators exist; browser-only storage is differentiator."
"Social Media Scheduler","Marketing, SaaS",4,"B2B SaaS; marketers pay for productivity tools with automation.",3,"APIs and queue handling; moderately complex.",5,"Many established incumbents."
"AI Speaking Practice Tutor","Education, AI, Mobile",4,"Subscription model; students and professionals willing to pay.",3,"TTS + AI conversation system; moderate complexity.",3,"Few tools focus on rapid speaking skill improvement."
"Reading Tracker App","Productivity, Mobile",3,"Freemium or subscription; useful for avid readers and students.",4,"Basic CRUD app; can be lightweight mobile app.",3,"Some tracking apps exist; focus on UX differentiates it."
"Job Matching Web App","HR Tech, AI, SaaS",4,"Companies may pay for faster candidate matching; premium features for job seekers.",3,"Requires smart CV parsing and AI matching; browser extension adds complexity.",4,"Several job platforms exist; instant AI application is niche."
"AI Study Material Generator","Education, AI",3,"Free basic use; potential subscription for teachers or students.",3,"Parsing PDFs/PPTs/Youtube + AI summarisation; moderate complexity.",3,"Some edtech tools exist; AI summarisation with flashcards is niche."
"Lightweight Photo Editor","Productivity, Mobile",3,"Freemium with pro features for hobbyists or beginners.",4,"Basic image processing; limited feature set keeps complexity low.",4,"Many photo editors exist; beginner-focused UX helps differentiation."
"Affordable Customer Support Tool","Customer Support, SaaS",4,"Small teams and solo founders are willing to pay; low-cost SaaS.",3,"Ticketing system + automation; moderate complexity.",4,"Many support tools exist; affordability and simplicity differentiates."
"Offline Screenshot Tool","Productivity, Desktop",3,"Free download; could monetise with premium features or enterprise edition.",4,"Desktop-only; local screenshot capture is simple; offline handling is easy.",3,"Some offline screenshot tools exist; simplicity is a differentiator."
"AI Role-Play for Workplace Conversations","HR Tech, AI",4,"Subscription for HR teams or employees; personalised AI feedback is valuable.",3,"AI character simulation and feedback; moderate complexity.",3,"Few tools focus on AI-guided role play for workplace conversations."
"Procure-to-Pay Automation Platform","Finance, SaaS",5,"B2B SaaS; companies willing to pay to automate procurement processes.",2,"Complex workflows and integrations; enterprise-grade complexity.",3,"Some enterprise tools exist; niche for SMBs with automation focus."
"Voice Assistance for Non-Speaking Users","Accessibility, AI",4,"Subscription or one-time purchase; high value for accessibility tools.",3,"Text-to-speech generation and interface; moderate complexity.",3,"Few apps provide high-quality TTS for non-speaking users."
"Recruiter Automation Tool","HR Tech, AI",4,"B2B SaaS for HR teams; saves recruiters time and effort.",3,"AI CV parsing, scoring, and automation; moderate complexity.",4,"Some recruiting tools exist, but AI-driven automation is still niche."
"Product Documentation Generator for PMs","Productivity, AI",3,"PMs and small teams may pay for faster documentation.",3,"Template system + AI summarisation; moderate complexity.",3,"Few AI-first PM documentation tools exist."
"Virtual Tour Builder Plugin","Web, Productivity",3,"Freemium; website owners may pay for pro features.",3,"Panorama scenes + hotspot navigation; moderate complexity.",3,"Some VR tour plugins exist, but UX focus can differentiate."
"Custom Welding Machine Branding","Manufacturing, B2B",4,"B2B; manufacturers pay for customised branding.",2,"Physical product modifications; requires equipment and expertise.",3,"Few competitors in niche market; B2B advantage."
"Mobile App Curation Subreddit","Community, Web",2,"Community-based; monetisation is limited unless ads or sponsorships.",5,"Simple subreddit creation; minimal technical work.",3,"Many tech-focused subreddits exist; niche can still grow."
"Open Source Multi-Agent System for Local Enterprise Development","AI, Enterprise, Open Source",3,"Could monetise via consulting, enterprise support, or premium modules.",2,"Complex AI + multi-agent coordination; high technical barrier.",3,"Few open-source enterprise-focused multi-agent systems exist."
"AI Visibility Platform for Businesses","AI, Marketing",4,"Subscription model; brands want presence in AI search.",3,"GEO analysis + AI response mapping; moderate complexity.",3,"Few platforms focus specifically on AI search visibility."
"Internal Knowledge Base for Non-Technical Users","Productivity, SaaS",3,"Subscription or SaaS for teams; helps internal knowledge management.",4,"Knowledge base + context-aware search; manageable.",3,"Many knowledge bases exist; non-technical UX focus is niche."
"Sleep Experiment Tracker","Health, Mobile",3,"Freemium; wearable users may pay for advanced analytics.",3,"Integration with wearables + experiment timeline; moderate complexity.",3,"Some sleep apps exist; controlled experiment tracking is niche."
"Super Launch Platform","Marketing, SaaS",4,"Subscription for startups to launch products; B2B SaaS.",3,"Landing pages + analytics; moderate complexity.",3,"Some launchpads exist; clean, minimal UX is differentiator."
"Lead Generation via Social Monitoring","Marketing, SaaS",4,"B2B; startups and agencies pay for real-time lead notifications.",3,"Monitoring + notification system; moderate complexity.",3,"Some lead-gen tools exist; social monitoring focus is differentiator."
"Email Marketing Automation for Stripe Users","Marketing, SaaS",4,"B2B SaaS; businesses pay for trial-to-paid conversion automation.",3,"Integration with Stripe + campaign automation; moderate complexity.",4,"Many marketing automation tools exist; Stripe-specific focus is niche."
"Product Update Notification Page + Widget","Productivity, SaaS",3,"Freemium SaaS; teams pay for more branding/customisation options.",4,"Frontend + small backend; moderate difficulty.",3,"Few tools allow easy update pages + widgets for SaaS teams."
"Developer Project Planning Tool","Productivity, AI, SaaS",4,"Subscription for developers and enterprises; helps speed project planning.",3,"AI prompts + task breakdown + git integration; moderate complexity.",4,"Some tools exist; AI-driven breakdown is a differentiator."
"Website Conversion Optimisation Tool","Marketing, SaaS",4,"B2B SaaS; businesses pay for higher conversion.",3,"Analytics + copy suggestions; moderate complexity.",4,"Several CRO tools exist; free during MVP helps adoption."
"Travel Itinerary Builder for Agents","Travel, Productivity",3,"Freemium or subscription for travel agents; saves time.",3,"Template system + itinerary generation; moderate complexity.",3,"Some tools exist; fast, automated itinerary creation is niche."
"AI Webpage Assistant Chrome Extension","AI, Productivity",3,"Freemium; could monetise advanced AI features.",3,"Web scraping + AI summarisation; moderate complexity.",3,"Some webpage AI tools exist; extension convenience differentiates."
"Launch Pack for First Sales","Marketing, SaaS",4,"Subscription or one-time payment; early-stage startups need help with sales.",3,"Landing pages + content + outreach integration; moderate complexity.",3,"Launch packs exist, but comprehensive first-sales focus is niche."
"VR Tours WordPress Plugin","Web, Productivity",3,"Freemium plugin; website owners pay for premium features.",3,"Panorama + interactive hotspots; moderate difficulty.",3,"Few easy-to-use VR WordPress plugins exist."
"Tab-Based AI Quick Input Tool","Productivity, AI",3,"Freemium; could monetise pro features for power users.",3,"Keyboard shortcut handling + AI integration; moderate complexity.",3,"Few similar productivity AI input tools exist."
"Kids Learning Insights Platform","Education, Analytics",4,"B2C SaaS; parents and schools may pay for learning insights.",3,"Data aggregation + profile generation; moderate complexity.",3,"Some edtech tools exist; personalised insights are differentiator."
"Automated Stripe Campaigns Tool","Marketing, SaaS",4,"B2B SaaS; helps businesses improve conversion from trial to paid.",3,"Stripe integration + automated campaign system; moderate complexity.",4,"Marketing automation exists; Stripe-specific focus is niche."
"Virtual Tour Creator for WordPress","Web, Productivity",3,"Freemium plugin for website owners; premium for advanced features.",3,"Panorama + hotspots + navigation; moderate difficulty.",3,"Few VR tour WordPress plugins exist with easy UX."
"Custom AI Voice Generator","AI, Accessibility",4,"Subscription or one-time purchase; accessibility and creative users.",3,"TTS engine integration; moderate complexity.",3,"Few high-quality custom voice generators exist."
"Nail Biting Prevention App for Mac","Health, Desktop",3,"Freemium; could sell advanced reminders or analytics.",4,"Desktop app with notifications and detection; manageable.",3,"Few habit apps focus specifically on nail biting on Mac."
"AI Photo Studio","AI, Creativity",4,"Freemium or paid subscriptions for professional photo editing and AI effects.",3,"AI image generation and editing pipelines; moderate complexity.",4,"Some AI photo tools exist, but demand is high and feature differentiation is possible."
"AI Podcast Analytics and Coach","AI, Content, Media",4,"Subscription for podcasters who want detailed AI-driven feedback.",3,"Audio analysis + AI feedback generation; moderate complexity.",3,"Most podcast analytics focus on basic metrics; content-driven AI is niche."
"Automated Pinterest Posting Tool","Marketing, Productivity",3,"Freemium or subscription for social media users and marketers.",4,"API integration for posting; relatively straightforward.",3,"Some social media automation tools exist, but Pinterest-focused automation is niche."
"AI Growth Engine for Engagement","AI, Marketing",4,"B2B SaaS helping startups increase retention and revenue; subscription model.",3,"AI recommendations + user engagement tracking; moderate complexity.",3,"Many growth tools exist, but integrated AI-driven challenge system is novel."
"Startup Visibility on AI Platforms","AI, Marketing",4,"B2B subscription for companies wanting visibility in AI search results.",3,"GEO + AI response management; moderate complexity.",3,"Few platforms optimise brands for AI responses specifically."
"Endless Scroll Movie Discovery","Entertainment, Media",3,"Ads or subscription; monetises discovery and engagement.",4,"Video feed with clips and recommendations; relatively straightforward.",3,"Movie recommendation exists, but short clip endless scroll is less common."
"Search Engine for Coding Courses","Education, AI",3,"Ads or affiliate commissions from course providers.",3,"Search and API integration; moderate complexity.",3,"Some course search engines exist, but AI summarisation adds differentiation."
"Smart Child Tracker App","Parenting, Mobile",3,"Subscription or freemium for parents wanting child activity tracking.",4,"App with tracking and notifications; manageable complexity.",3,"Child tracking apps exist, but smart/AI features are less common."
"Competitive Paper Trading Game","Finance, Gamification",3,"Freemium, ads, or premium leaderboards for trading enthusiasts.",4,"Simulated market + scoring; manageable.",3,"Some trading games exist, but competitive and instant-play design is niche."
"AI-Powered Cover Letter Generator","AI, Career",4,"Subscription for job seekers wanting personalised letters.",3,"Text generation with templates; moderate complexity.",3,"Few AI tools focus solely on cover letters with personalisation."
"Book Vocabulary Builder","Education, AI",3,"Subscription or freemium for readers to learn vocabulary.",4,"Text parsing + word tracking; fairly straightforward.",3,"Some vocabulary apps exist, but book-specific integration is less common."
"AI Brand Visibility Platform","Marketing, AI",4,"B2B subscriptions for visibility across AI platforms.",3,"GEO data + AI search integration; moderate complexity.",3,"Few competitors target AI response visibility specifically."
"Smart Investment Assistant","Finance, AI",4,"Subscription for personal finance and investing insights.",3,"Finance data + AI recommendations; moderate complexity.",4,"Many finance tools exist, but gamified AI assistant is niche."
"AI Memory Transfer Tool","AI, Productivity",3,"Subscription for AI developers to manage multi-AI memory.",3,"Backend management + API integration; moderate.",3,"Few tools exist to transfer memory across AI systems."
"End-to-End MVP Platform","Developer Tools, SaaS",4,"B2B SaaS for developers and startups; subscription or pay-per-project.",3,"Full workflow integration; moderate complexity.",3,"Some MVP platforms exist, but cloud-independent and no vendor lock-in is rare."
"AI Feedback for SaaS & eCom","AI, Marketing",4,"B2B SaaS; subscription for actionable insights from customer surveys.",3,"AI summarisation + dashboard; moderate.",3,"Many analytics dashboards exist, but AI-driven instant summaries are niche."
"Movie Clip Discovery Platform","Entertainment, Media",3,"Ads or premium features for curated movie clip discovery.",4,"Endless scroll + video clips; straightforward.",3,"Entertainment discovery exists, but short clips + gamified scroll is less common."
"Coding Course Search Engine","Education, AI",3,"Ads, affiliate commissions, or freemium subscriptions.",3,"Search engine + AI summarisation; moderate complexity.",3,"Some search engines exist, AI summarisation adds uniqueness."
"AI-Powered Child Tracker","Parenting, Mobile",3,"Subscription for parents, freemium or premium features.",4,"Mobile app with tracking + alerts; manageable.",3,"Child tracking apps exist, but AI smart alerts are rare."
"Paper Trading Competition Game","Finance, Gamification",3,"Freemium, ads, or premium leaderboards.",4,"Simulated market + scoring; straightforward.",3,"Trading games exist, but competitive leaderboard is niche."
"Personalized AI Cover Letter Generator","Career, AI",4,"Subscription for job seekers.",3,"Text generation + templates; moderate complexity.",3,"Few competitors focus solely on AI-generated cover letters."
"Daily Learning Digest","Education, Productivity",3,"Subscription for curated daily learning emails.",4,"Email automation + content aggregation; straightforward.",3,"Some daily learning emails exist, curation quality differentiates."
"Multi-Provider AI Chat GUI","AI, Productivity",3,"Subscription or one-time purchase for AI power users.",3,"GUI integration + API handling; moderate complexity.",3,"Few GUI tools allow multi-provider AI memory and local search."
"Tiny Tot Activity Tracker","Parenting, Mobile",3,"Subscription for parents.",4,"Mobile app + notifications; manageable.",3,"Child trackers exist, AI or smart features add differentiation."
"Instant Opinion Analysis Tool","AI, Marketing",4,"B2B SaaS for product feedback; subscription.",3,"Survey deployment + AI analysis; moderate complexity.",3,"Feedback analysis exists, AI summarisation for SaaS & eCom is niche."
"No-Code MVP Builder","Developer Tools, SaaS",4,"Subscription or usage-based; SaaS for startups.",3,"End-to-end workflow; moderate complexity.",3,"No-code MVP tools exist, cloud-independent approach adds uniqueness."
"AI Movie Clip Discovery Feed","Entertainment, Media",3,"Ads or premium subscription for entertainment discovery.",4,"Video feed + recommendations; manageable.",3,"Movie recommendation exists, short clips feed is less saturated."
"Personal Finance Learning Companion","Finance, Education",4,"Subscription or freemium for investing and finance learning.",3,"Content + interactive simulations; moderate complexity.",3,"Finance education apps exist, gamified AI companion is less common."
"AI Conversational Memory Manager","AI, Productivity",3,"Subscription for AI developers and enthusiasts.",3,"Cross-AI memory handling; moderate complexity.",3,"Few tools exist for storing and transferring AI memory."
